<!ELEMENT bsa (council+)>
<!ELEMENT council (troop+)>
<!ATTLIST council name CDATA #REQUIRED>
<!ELEMENT troop (scout+)>
<!ATTLIST troop number CDATA #REQUIRED>
<!ATTLIST troop unit CDATA #REQUIRED>
<!ELEMENT scout (first-name,last-name,address,phone,rank*,meritbadge*)>
<!ELEMENT first-name (#PCDATA)>
<!ELEMENT last-name (#PCDATA)>
<!ELEMENT address (street,city,state)>
<!ELEMENT street (#PCDATA)>
<!ELEMENT city (#PCDATA)>
<!ELEMENT state (#PCDATA)>
<!ELEMENT phone (#PCDATA)>
<!ELEMENT rank (#PCDATA)>
<!ATTLIST rank date-earned CDATA #REQUIRED>
<!ELEMENT meritbadge (#PCDATA)>
<!ATTLIST meritbadge date-earned CDATA #REQUIRED>